18. Training Label-Noise Robustness Validation'/training_label_noise_robustness_final_report.csv

variant,target_label_noise_rate,actual_label_noise_rate,split,dataset,noisy_train_labels,acc,prec_macro,rec_macro,f1_macro,logloss,mcc,kappa,auc_roc_macro,pr_auc,prec_weighted,rec_weighted,f1_weighted,auc_roc_micro,auc_roc_weighted,ppv_macro,npv_macro,ppv_weighted,npv_weighted,ppv_positive,npv_negative
label_noise_05,0.0500,0.0500,VAL,I23Sub,810,0.9378,0.9682,0.6250,0.6836,0.3104,0.4839,0.3794,0.9973,0.9875,0.9417,0.9378,0.9201,0.9973,0.9973,0.9682,0.9682,0.9417,0.9947,1.0000,0.9365
label_noise_05,0.0500,0.0500,TEST,I23Sub,810,0.9352,0.9670,0.6107,0.6642,0.3088,0.4548,0.3428,0.9956,0.9784,0.9395,0.9352,0.9156,0.9956,0.9956,0.9670,0.9670,0.9395,0.9945,1.0000,0.9340
label_noise_05,0.0500,0.0500,VAL,K99Sub,882,0.9177,0.9191,0.9207,0.9177,0.5674,0.8398,0.8357,0.9742,0.9707,0.9223,0.9177,0.9178,0.9742,0.9742,0.9191,0.9191,0.9223,0.9159,0.9656,0.8726
label_noise_05,0.0500,0.0500,TEST,K99Sub,882,0.9116,0.9135,0.9148,0.9116,0.5667,0.8283,0.8237,0.9744,0.9705,0.9169,0.9116,0.9117,0.9744,0.9744,0.9135,0.9135,0.9169,0.9102,0.9631,0.8639
label_noise_05,0.0500,0.0500,VAL,NTD1,12881,0.9665,0.9409,0.8328,0.8776,0.1195,0.7660,0.7557,0.9887,0.8965,0.9652,0.9665,0.9642,0.9887,0.9887,0.9409,0.9409,0.9652,0.9165,0.9115,0.9702
label_noise_05,0.0500,0.0500,TEST,NTD1,12881,0.9636,0.9365,0.8161,0.8646,0.1234,0.7429,0.7299,0.9886,0.8907,0.9621,0.9636,0.9607,0.9886,0.9886,0.9365,0.9365,0.9621,0.9109,0.9057,0.9673
label_noise_05,0.0500,0.0500,VAL,NTD2,1954,0.8309,0.8639,0.8219,0.8238,0.6124,0.6846,0.6549,0.9323,0.9226,0.8583,0.8309,0.8258,0.9323,0.9323,0.8639,0.8639,0.8583,0.8696,0.9599,0.7679
label_noise_05,0.0500,0.0500,TEST,NTD2,1954,0.8248,0.8628,0.8152,0.8165,0.6130,0.6763,0.6420,0.9334,0.9275,0.8567,0.8248,0.8188,0.9334,0.9334,0.8628,0.8628,0.8567,0.8689,0.9665,0.7591
label_noise_05,0.0500,0.0500,VAL,WII21,41806,0.9995,0.9996,0.9969,0.9982,0.0242,0.9965,0.9965,1.0000,1.0000,0.9995,0.9995,0.9995,1.0000,1.0000,0.9996,0.9996,0.9995,0.9996,0.9995,0.9996
label_noise_05,0.0500,0.0500,TEST,WII21,41806,0.9996,0.9997,0.9977,0.9987,0.0241,0.9973,0.9973,1.0000,1.0000,0.9996,0.9996,0.9996,1.0000,1.0000,0.9997,0.9997,0.9996,0.9997,0.9996,0.9997
label_noise_05,0.0500,0.0500,VAL,global_weighted,58333,0.9845,0.9804,0.9485,0.9602,0.0772,0.9257,0.9209,0.9948,0.9739,0.9853,0.9845,0.9836,0.9948,0.9948,0.9804,0.9804,0.9853,0.9756,0.9782,0.9826
label_noise_05,0.0500,0.0500,TEST,global_weighted,58333,0.9836,0.9794,0.9448,0.9570,0.0779,0.9203,0.9146,0.9948,0.9727,0.9845,0.9836,0.9825,0.9948,0.9948,0.9794,0.9794,0.9845,0.9743,0.9772,0.9815
label_noise_10,0.1000,0.1000,VAL,I23Sub,1620,0.9171,0.4585,0.5000,0.4784,0.3874,0.0000,0.0000,0.9290,0.7707,0.8410,0.9171,0.8774,0.9290,0.9290,0.4585,0.4585,0.8410,0.0761,0.0000,0.9171
label_noise_10,0.1000,0.1000,TEST,I23Sub,1620,0.9168,0.4584,0.5000,0.4783,0.3865,0.0000,0.0000,0.9167,0.7208,0.8405,0.9168,0.8770,0.9167,0.9167,0.4584,0.4584,0.8405,0.0763,0.0000,0.9168
label_noise_10,0.1000,0.1000,VAL,K99Sub,1763,0.8566,0.8935,0.8462,0.8499,0.4958,0.7382,0.7061,0.9808,0.9715,0.8864,0.8566,0.8521,0.9808,0.9808,0.8935,0.8935,0.8864,0.9007,0.7887,0.9984
label_noise_10,0.1000,0.1000,TEST,K99Sub,1763,0.8611,0.8967,0.8510,0.8549,0.4955,0.7464,0.7155,0.9791,0.9711,0.8898,0.8611,0.8569,0.9791,0.9791,0.8967,0.8967,0.8898,0.9037,0.7935,1.0000
label_noise_10,0.1000,0.1000,VAL,NTD1,25761,0.9150,0.4575,0.5000,0.4778,0.1873,0.0000,0.0000,0.9442,0.8559,0.8372,0.9150,0.8744,0.9442,0.9442,0.4575,0.4575,0.8372,0.0778,0.0000,0.9150
label_noise_10,0.1000,0.1000,TEST,NTD1,25761,0.9150,0.4575,0.5000,0.4778,0.1934,0.0000,0.0000,0.9430,0.8461,0.8372,0.9150,0.8744,0.9430,0.9430,0.4575,0.4575,0.8372,0.0778,0.0000,0.9150
label_noise_10,0.1000,0.1000,VAL,NTD2,3908,0.8633,0.8721,0.8587,0.8610,0.6066,0.7307,0.7233,0.9660,0.9499,0.8695,0.8633,0.8620,0.9660,0.9660,0.8721,0.8721,0.8695,0.8748,0.9168,0.8275
label_noise_10,0.1000,0.1000,TEST,NTD2,3908,0.8639,0.8744,0.8589,0.8613,0.6076,0.7332,0.7243,0.9696,0.9588,0.8715,0.8639,0.8624,0.9696,0.9696,0.8744,0.8744,0.8715,0.8773,0.9243,0.8245
label_noise_10,0.1000,0.1000,VAL,WII21,83612,0.9994,0.9996,0.9963,0.9979,0.0716,0.9959,0.9959,1.0000,1.0000,0.9994,0.9994,0.9994,1.0000,1.0000,0.9996,0.9996,0.9994,0.9997,0.9994,0.9998
label_noise_10,0.1000,0.1000,TEST,WII21,83612,0.9993,0.9995,0.9955,0.9975,0.0719,0.9950,0.9950,1.0000,1.0000,0.9993,0.9993,0.9993,1.0000,1.0000,0.9995,0.9995,0.9993,0.9997,0.9993,0.9998
label_noise_10,0.1000,0.1000,VAL,global_weighted,116664,0.9729,0.8665,0.8729,0.8691,0.1259,0.7494,0.7486,0.9853,0.9629,0.9554,0.9729,0.9633,0.9853,0.9853,0.8665,0.8665,0.9554,0.7776,0.7589,0.9741
label_noise_10,0.1000,0.1000,TEST,global_weighted,116664,0.9729,0.8666,0.8725,0.8688,0.1275,0.7490,0.7482,0.9849,0.9603,0.9554,0.9729,0.9633,0.9849,0.9849,0.8666,0.8666,0.9554,0.7778,0.7591,0.9740
label_noise_30,0.3000,0.3000,VAL,I23Sub,4860,0.9816,0.9901,0.8889,0.9325,0.4223,0.8732,0.8652,0.9764,0.9396,0.9819,0.9816,0.9805,0.9764,0.9764,0.9901,0.9901,0.9819,0.9984,1.0000,0.9803
label_noise_30,0.3000,0.3000,TEST,I23Sub,4860,0.9798,0.9892,0.8789,0.9257,0.4202,0.8611,0.8516,0.9799,0.9437,0.9803,0.9798,0.9786,0.9799,0.9799,0.9892,0.9892,0.9803,0.9982,1.0000,0.9785
label_noise_30,0.3000,0.3000,VAL,K99Sub,5290,0.8830,0.9018,0.8758,0.8797,0.5689,0.7773,0.7618,0.9559,0.9356,0.8970,0.8830,0.8811,0.9559,0.9559,0.9018,0.9018,0.8970,0.9067,0.8303,0.9734
label_noise_30,0.3000,0.3000,TEST,K99Sub,5290,0.8809,0.8990,0.8739,0.8777,0.5702,0.7724,0.7576,0.9511,0.9284,0.8943,0.8809,0.8790,0.9511,0.9511,0.8990,0.8990,0.8943,0.9037,0.8293,0.9686
label_noise_30,0.3000,0.3000,VAL,NTD1,77283,0.9150,0.4575,0.5000,0.4778,0.2734,0.0000,0.0000,0.9811,0.8720,0.8372,0.9150,0.8744,0.9811,0.9811,0.4575,0.4575,0.8372,0.0778,0.0000,0.9150
label_noise_30,0.3000,0.3000,TEST,NTD1,77283,0.9150,0.4575,0.5000,0.4778,0.2755,0.0000,0.0000,0.9790,0.8578,0.8372,0.9150,0.8744,0.9790,0.9790,0.4575,0.4575,0.8372,0.0778,0.0000,0.9150
label_noise_30,0.3000,0.3000,VAL,NTD2,11723,0.7854,0.8143,0.7760,0.7759,0.6275,0.5891,0.5617,0.9375,0.9170,0.8096,0.7854,0.7786,0.9375,0.9375,0.8143,0.8143,0.8096,0.8191,0.8962,0.7325
label_noise_30,0.3000,0.3000,TEST,NTD2,11723,0.7932,0.8238,0.7837,0.7839,0.6270,0.6062,0.5775,0.9422,0.9234,0.8188,0.7932,0.7865,0.9422,0.9422,0.8238,0.8238,0.8188,0.8288,0.9099,0.7378
label_noise_30,0.3000,0.3000,VAL,WII21,250837,0.9271,0.4636,0.5000,0.4811,0.2651,0.0000,0.0000,0.9982,0.9999,0.8596,0.9271,0.8921,0.9982,0.9982,0.4636,0.4636,0.8596,0.0675,0.9271,0.0000
label_noise_30,0.3000,0.3000,TEST,WII21,250837,0.9272,0.4636,0.5000,0.4811,0.2652,0.0000,0.0000,0.9981,0.9998,0.8596,0.9272,0.8921,0.9981,0.9981,0.4636,0.4636,0.8596,0.0675,0.9272,0.0000
label_noise_30,0.3000,0.3000,VAL,global_weighted,349993,0.9198,0.4879,0.5203,0.5025,0.2859,0.0436,0.0423,0.9915,0.9670,0.8553,0.9198,0.8854,0.9915,0.9915,0.4879,0.4879,0.8553,0.1206,0.7209,0.2549
label_noise_30,0.3000,0.3000,TEST,global_weighted,349993,0.9200,0.4882,0.5204,0.5027,0.2864,0.0439,0.0426,0.9910,0.9641,0.8555,0.9200,0.8857,0.9910,0.9910,0.4882,0.4882,0.8555,0.1209,0.7214,0.2550

1. GRIP-DFFI/1_grip_dffi_main_OUTPUT_VIEW.md

####################################################################################################

[I23Sub] 2 clients
      client=00 | n= 9854 | train_acc=0.9969 | val_acc=0.9983 | val_f1=0.9943 | val_auc=0.9973 | time=2.2s
      client=01 | n= 6347 | train_acc=0.9975 | val_acc=0.9968 | val_f1=0.9894 | val_auc=0.9972 | time=1.8s

[WII21] 46 clients
      client=00 | n= 8354 | train_acc=1.0000 | val_acc=1.0000 | val_f1=1.0000 | val_auc=1.0000 | time=2.7s
      client=01 | n=25751 | train_acc=1.0000 | val_acc=1.0000 | val_f1=0.9998 | val_auc=0.9999 | time=6.1s
      client=02 | n=42801 | train_acc=1.0000 | val_acc=1.0000 | val_f1=0.9998 | val_auc=0.9998 | time=9.5s
      client=03 | n=15271 | train_acc=1.0000 | val_acc=1.0000 | val_f1=0.9999 | val_auc=1.0000 | time=4.1s
      client=04 | n=17243 | train_acc=1.0000 | val_acc=1.0000 | val_f1=1.0000 | val_auc=1.0000 | time=4.4s
      client=05 | n=44654 | train_acc=1.0000 | val_acc=1.0000 | val_f1=1.0000 | val_auc=1.0000 | time=9.9s
      client=06 | n=47255 | train_acc=1.0000 | val_acc=1.0000 | val_f1=1.0000 | val_auc=1.0000 | time=10.4s
      client=07 | n=  457 | train_acc=1.0000 | val_acc=1.0000 | val_f1=1.0000 | val_auc=1.0000 | time=1.1s
      client=08 | n=12388 | train_acc=1.0000 | val_acc=1.0000 | val_f1=0.9999 | val_auc=1.0000 | time=3.4s
      client=09 | n=12876 | train_acc=1.0000 | val_acc=1.0000 | val_f1=0.9999 | val_auc=1.0000 | time=3.6s
      client=10 | n= 6523 | train_acc=1.0000 | val_acc=1.0000 | val_f1=1.0000 | val_auc=1.0000 | time=2.3s
      client=11 | n= 6709 | train_acc=1.0000 | val_acc=1.0000 | val_f1=1.0000 | val_auc=1.0000 | time=2.3s
      client=12 | n= 3239 | train_acc=1.0000 | val_acc=1.0000 | val_f1=1.0000 | val_auc=1.0000 | time=1.7s
      client=13 | n=  259 | train_acc=1.0000 | val_acc=1.0000 | val_f1=1.0000 | val_auc=1.0000 | time=1.1s
      client=14 | n= 8000 | train_acc=1.0000 | val_acc=1.0000 | val_f1=1.0000 | val_auc=1.0000 | time=2.7s
      client=15 | n=44321 | train_acc=1.0000 | val_acc=1.0000 | val_f1=0.9999 | val_auc=1.0000 | time=9.9s
      client=16 | n=87021 | train_acc=1.0000 | val_acc=1.0000 | val_f1=1.0000 | val_auc=1.0000 | time=18.3s
      client=17 | n= 6986 | train_acc=1.0000 | val_acc=1.0000 | val_f1=1.0000 | val_auc=1.0000 | time=2.4s
      client=18 | n= 9329 | train_acc=1.0000 | val_acc=1.0000 | val_f1=1.0000 | val_auc=1.0000 | time=2.8s
      client=19 | n=37143 | train_acc=1.0000 | val_acc=1.0000 | val_f1=1.0000 | val_auc=1.0000 | time=8.4s
      client=20 | n=34755 | train_acc=1.0000 | val_acc=1.0000 | val_f1=0.9999 | val_auc=0.9999 | time=7.9s
      client=21 | n= 7268 | train_acc=1.0000 | val_acc=1.0000 | val_f1=1.0000 | val_auc=1.0000 | time=2.4s
      client=22 | n=15886 | train_acc=1.0000 | val_acc=1.0000 | val_f1=1.0000 | val_auc=1.0000 | time=4.2s
      client=23 | n=18446 | train_acc=1.0000 | val_acc=0.9999 | val_f1=0.9998 | val_auc=1.0000 | time=4.7s
      client=24 | n=21907 | train_acc=1.0000 | val_acc=1.0000 | val_f1=0.9998 | val_auc=0.9997 | time=5.4s
      client=25 | n=15749 | train_acc=1.0000 | val_acc=1.0000 | val_f1=0.9998 | val_auc=0.9997 | time=4.2s
      client=26 | n=41900 | train_acc=1.0000 | val_acc=1.0000 | val_f1=0.9999 | val_auc=1.0000 | time=9.3s
      client=27 | n=22675 | train_acc=1.0000 | val_acc=1.0000 | val_f1=1.0000 | val_auc=1.0000 | time=5.6s
      client=28 | n=22659 | train_acc=1.0000 | val_acc=1.0000 | val_f1=0.9999 | val_auc=0.9999 | time=5.5s
      client=29 | n= 6231 | train_acc=1.0000 | val_acc=1.0000 | val_f1=1.0000 | val_auc=1.0000 | time=2.2s
      client=30 | n=11135 | train_acc=1.0000 | val_acc=1.0000 | val_f1=0.9998 | val_auc=0.9998 | time=3.2s
      client=31 | n=10805 | train_acc=1.0000 | val_acc=1.0000 | val_f1=0.9999 | val_auc=1.0000 | time=3.2s
      client=32 | n=11918 | train_acc=1.0000 | val_acc=1.0000 | val_f1=1.0000 | val_auc=1.0000 | time=3.4s
      client=33 | n=12890 | train_acc=1.0000 | val_acc=1.0000 | val_f1=1.0000 | val_auc=1.0000 | time=3.6s
      client=34 | n= 5447 | train_acc=1.0000 | val_acc=1.0000 | val_f1=1.0000 | val_auc=1.0000 | time=2.1s
      client=35 | n=  743 | train_acc=1.0000 | val_acc=1.0000 | val_f1=1.0000 | val_auc=1.0000 | time=1.2s
      client=36 | n=52117 | train_acc=1.0000 | val_acc=1.0000 | val_f1=1.0000 | val_auc=1.0000 | time=11.4s
      client=37 | n= 3378 | train_acc=1.0000 | val_acc=1.0000 | val_f1=1.0000 | val_auc=1.0000 | time=1.7s
      client=38 | n= 7628 | train_acc=1.0000 | val_acc=1.0000 | val_f1=1.0000 | val_auc=1.0000 | time=2.5s
      client=39 | n=10187 | train_acc=1.0000 | val_acc=1.0000 | val_f1=1.0000 | val_auc=1.0000 | time=3.0s
      client=40 | n= 2932 | train_acc=1.0000 | val_acc=1.0000 | val_f1=1.0000 | val_auc=1.0000 | time=1.6s
      client=41 | n=36349 | train_acc=1.0000 | val_acc=1.0000 | val_f1=1.0000 | val_auc=1.0000 | time=8.2s
      client=42 | n= 5003 | train_acc=1.0000 | val_acc=1.0000 | val_f1=1.0000 | val_auc=1.0000 | time=2.0s
      client=43 | n=14026 | train_acc=1.0000 | val_acc=1.0000 | val_f1=0.9999 | val_auc=1.0000 | time=3.8s
      client=44 | n= 4514 | train_acc=1.0000 | val_acc=1.0000 | val_f1=1.0000 | val_auc=1.0000 | time=1.9s
      client=45 | n= 2996 | train_acc=1.0000 | val_acc=1.0000 | val_f1=1.0000 | val_auc=1.0000 | time=1.6s
      [VAL] I23Sub | acc=0.9957 | f1=0.9856 | auc=0.9971 | logloss=0.0249
      [VAL] K99Sub | acc=0.8529 | f1=0.8529 | auc=0.9745 | logloss=0.3920
      [VAL] NTD1 | acc=0.9669 | f1=0.8786 | auc=0.9838 | logloss=0.1158
      [VAL] NTD2 | acc=0.5517 | f1=0.3970 | auc=0.9418 | logloss=0.8029
      [VAL] WII21 | acc=1.0000 | f1=1.0000 | auc=1.0000 | logloss=0.0000
    ----------------------------------------------------------------------------------------------------
    GLOBAL VAL | acc=0.9754 | f1=0.9506 | logloss=0.0587 | round_time=943.3s