18. Training Label-Noise Robustness Validation'/training_label_noise_robustness_final_report_with_deltas.csv

variant,target_label_noise_rate,actual_label_noise_rate,noisy_train_labels,split,dataset,acc,precision_macro,recall_macro,f1_macro,precision_weighted,recall_weighted,f1_weighted,logloss,mcc,kappa,auc_roc_macro_ovr,auc_roc_micro_ovr,auc_roc_weighted_ovr,pr_auc_macro,ppv_macro_ovr,npv_macro_ovr,ppv_weighted_ovr,npv_weighted_ovr,ppv_positive,npv_negative
label_noise_05,0.05,0.0499969137707548,810,VAL,I23Sub,0.9377880184331796,0.9682352941176472,0.625,0.6835965978128797,0.9417403090268366,0.9377880184331796,0.920144912117632,0.3104320629566818,0.4838570522983245,0.3794089609151573,0.997276966429369,0.997276966429369,0.997276966429369,0.9875140109355856,0.9682352941176472,0.9682352941176472,0.9417403090268366,0.9947302792084576,1.0,0.9364705882352942
label_noise_05,0.05,0.0499969137707548,810,TEST,I23Sub,0.9351958525345622,0.9669894366197184,0.610726643598616,0.6642343860608272,0.9394742953689882,0.9351958525345622,0.915649097178169,0.3087631699002744,0.4547886230455198,0.3427694544279771,0.9955548888069948,0.9955548888069948,0.9955548888069948,0.9783724493129472,0.9669894366197184,0.9669894366197184,0.9394742953689882,0.9945045778704484,1.0,0.9339788732394366
label_noise_05,0.05,0.050017012589316,882,VAL,K99Sub,0.917703096057158,0.9190946050734816,0.9206654589106896,0.9176732111173588,0.9222593645176864,0.917703096057158,0.9177798837496978,0.567386748662101,0.839758594764544,0.8357402248320427,0.9741787287496012,0.9741787287496012,0.9741787287496012,0.9706833670916036,0.9190946050734816,0.9190946050734816,0.9222593645176864,0.9159298456292766,0.9656301145662848,0.8725590955806783
label_noise_05,0.05,0.050017012589316,882,TEST,K99Sub,0.9116168298491664,0.9135202025047168,0.9148001071482637,0.9115981043599386,0.9168675130368916,0.9116168298491664,0.911684922537268,0.5667236272661405,0.8283193208103458,0.8236901493914994,0.9744141314153194,0.9744141314153194,0.9744141314153194,0.9705243639659108,0.9135202025047168,0.9135202025047168,0.9168675130368916,0.910172891972542,0.9631260319207484,0.863914373088685
label_noise_05,0.05,0.0500017468198174,12881,VAL,NTD1,0.9665416734597756,0.9408519329989532,0.8327552705467767,0.8776420448664823,0.9652276338454072,0.9665416734597756,0.9642083746687544,0.1195106427953167,0.7660177654235865,0.7557311896274798,0.9887265952705044,0.9887265952705044,0.9887265952705044,0.8964705477157121,0.9408519329989532,0.9408519329989532,0.9652276338454072,0.9164762321524994,0.9114839456175876,0.9702199203803192
label_noise_05,0.05,0.0500017468198174,12881,TEST,NTD1,0.963607050341467,0.9364912733634664,0.8161103094061708,0.8646441019978699,0.9620611491286104,0.963607050341467,0.960703281783866,0.1233778749499899,0.7429115464872488,0.7299205076955899,0.9885597419848338,0.9885597419848338,0.9885597419848338,0.8906573765105283,0.9364912733634664,0.9364912733634664,0.9620611491286104,0.9109213975983228,0.905683192261185,0.967299354465748
label_noise_05,0.05,0.0500025589845949,1954,VAL,NTD2,0.8309051827083831,0.8639438588971695,0.821938299384395,0.8237610223824516,0.8583265961169803,0.8309051827083831,0.8258373204605693,0.612377249350412,0.6845946742555014,0.6548598072735681,0.9323249505006712,0.9323249505006712,0.9323249505006712,0.9225558016973444,0.8639438588971695,0.8639438588971695,0.8583265961169803,0.8695611216773588,0.9599417334304444,0.7679459843638948
label_noise_05,0.05,0.0500025589845949,1954,TEST,NTD2,0.8248149032720324,0.8627930453484965,0.815175012867078,0.8165347215652077,0.8567274359555802,0.8248149032720324,0.8188153786963737,0.6129780325498174,0.6762937312611993,0.6419539940772266,0.933443207190178,0.933443207190178,0.933443207190178,0.9275366146403344,0.8627930453484965,0.8627930453484965,0.8567274359555802,0.8688586547414129,0.9664530719939692,0.759133018703024
label_noise_05,0.05,0.0499997608010295,41806,VAL,WII21,0.9995255902215772,0.9995666808399958,0.9969205207332736,0.998239438243648,0.9995256304502296,0.9995255902215772,0.9995249603271784,0.0242479146019801,0.9964836881434714,0.9964788787769532,0.9999937744578196,0.9999937744578196,0.9999937744578196,0.9999995068231076,0.9995666808399958,0.9995666808399958,0.9995256304502296,0.999607731229762,0.9995186290555502,0.9996147326244412
label_noise_05,0.05,0.0499997608010295,41806,TEST,WII21,0.9996372160517945,0.9996625532045196,0.997651153745848,0.99865445028788,0.999637234908273,0.9996372160517945,0.9996368502174746,0.0241029850120156,0.9973116786357722,0.9973089015859438,0.999980409765768,0.999980409765768,0.999980409765768,0.9999984402554342,0.9996625532045196,0.9996625532045196,0.999637234908273,0.9996878715007662,0.9996329171054612,0.9996921893035784
label_noise_05,0.05,0.0500005142939429,58333,VAL,global_weighted,0.984499875999008,0.9804072384242968,0.948491367883114,0.9601778542497472,0.9852520247612891,0.984499875999008,0.9835705769076518,0.0771680837658968,0.925658030571263,0.9208758302847184,0.9948112184385688,0.9948112184385688,0.9948112184385688,0.9739282660527994,0.9804072384242968,0.9804072384242968,0.9852520247612891,0.975562452087304,0.978248103170838,0.9825663736777556
label_noise_05,0.05,0.0500005142939429,58333,TEST,global_weighted,0.9835998687989504,0.9793729411919078,0.9448261293931514,0.9570023720343136,0.984466266241496,0.9835998687989504,0.9824870146427334,0.0779050752940895,0.9202945946769356,0.9146480413851324,0.9947818960475218,0.9947818960475218,0.9947818960475218,0.9726813495408632,0.9793729411919078,0.9793729411919078,0.984466266241496,0.9742796161423192,0.9772293791137756,0.9815165032700398
label_noise_10,0.1,0.0999938275415097,1620,VAL,I23Sub,0.9170506912442395,0.4585253456221198,0.5,0.4783653846153846,0.8409819703115378,0.9170506912442395,0.8773706132577102,0.3874044394550238,0.0,0.0,0.9290397298994976,0.9290397298994976,0.9290397298994976,0.7707326408938487,0.4585253456221198,0.4585253456221198,0.8409819703115378,0.0760687209327019,0.0,0.9170506912442395
label_noise_10,0.1,0.0999938275415097,1620,TEST,I23Sub,0.91676267281106,0.4583813364055299,0.5,0.4782870022539444,0.8404537982596785,0.91676267281106,0.8769513411142309,0.3865374501500022,0.0,0.0,0.9167202058513708,0.9167202058513708,0.9167202058513708,0.7207509639378052,0.4583813364055299,0.4583813364055299,0.8404537982596785,0.0763088745513814,0.0,0.91676267281106
label_noise_10,0.1,0.0999773165475785,1763,VAL,K99Sub,0.8565758137073299,0.8935485356949546,0.8461824837113339,0.8499343825867387,0.8864202614632821,0.8565758137073299,0.8520813609489927,0.4957864366976944,0.7382130032662333,0.7061013354608108,0.9807610269640246,0.9807610269640246,0.9807610269640246,0.9714561228954878,0.8935485356949546,0.8935485356949546,0.8864202614632821,0.9006768099266272,0.7887323943661971,0.9983646770237122
label_noise_10,0.1,0.0999773165475785,1763,TEST,K99Sub,0.8610743582958454,0.8967348544453186,0.8510215664018161,0.854892407288501,0.8897667115195595,0.8610743582958454,0.8569134297332097,0.4954690102112397,0.7463577963780971,0.7155197000071551,0.979129020803308,0.979129020803308,0.979129020803308,0.9710943136796149,0.8967348544453186,0.8967348544453186,0.8897667115195595,0.9037029973710776,0.7934697088906373,1.0
label_noise_10,0.1,0.0999996118178183,25761,VAL,NTD1,0.9150046193141677,0.4575023096570838,0.5,0.4778080481298598,0.837233453366265,0.9150046193141677,0.8743931423686158,0.1873301951074487,0.0,0.0,0.944235206049249,0.944235206049249,0.944235206049249,0.855871162249263,0.4575023096570838,0.4575023096570838,0.837233453366265,0.0777711659479027,0.0,0.9150046193141677
label_noise_10,0.1,0.0999996118178183,25761,TEST,NTD1,0.9149865043566472,0.4574932521783236,0.5,0.4778031084161834,0.8372003031547969,0.9149865043566472,0.8743667918809278,0.193412419308393,0.0,0.0,0.9430249975711202,0.9430249975711202,0.9430249975711202,0.8460766138685061,0.4574932521783236,0.4574932521783236,0.8372003031547969,0.0777862012018503,0.0,0.9149865043566472
label_noise_10,0.1,0.1000051179691898,3908,VAL,NTD2,0.8632672557917364,0.8721481024862601,0.8586816487992863,0.860967499438511,0.8695329493129929,0.8632672557917364,0.8620138138424853,0.6066246662681808,0.7307056726132556,0.7233174059014624,0.9659757080098248,0.9659757080098248,0.9659757080098248,0.9499035943220112,0.8721481024862601,0.8721481024862601,0.8695329493129929,0.8747632556595273,0.9168405365126676,0.8274556684598525
label_noise_10,0.1,0.1000051179691898,3908,TEST,NTD2,0.8638643420109864,0.8744075619976039,0.8589091694186645,0.8613394435799184,0.8714888174815347,0.8638643420109864,0.8624343110411781,0.6076291273933222,0.7331529365708828,0.7243190307300205,0.9696494362296624,0.9696494362296624,0.9696494362296624,0.9588339382488414,0.8744075619976039,0.8744075619976039,0.8714888174815347,0.8773263065136733,0.9242883101150816,0.8245268138801262
label_noise_10,0.1,0.099999521602059,83612,VAL,WII21,0.9994474521404252,0.99959546797113,0.9963136546601434,0.997948155614426,0.9994476317876978,0.9994474521404252,0.9994465417375256,0.0716205256209033,0.995903715346812,0.9958963153345196,0.9999939400233904,0.9999939400233904,0.9999939400233904,0.9999995227480544,0.99959546797113,0.99959546797113,0.9994476317876978,0.999743304154562,0.999422417423741,0.9997685185185186
label_noise_10,0.1,0.099999521602059,83612,TEST,WII21,0.9993302450186972,0.999532144650066,0.995508898560995,0.9975108872057524,0.9993305453117026,0.9993302450186972,0.9993288910117076,0.0719053887248015,0.995032909589157,0.9950217819015024,0.9999899689698808,0.9999899689698808,0.9999899689698808,0.9999992092090634,0.999532144650066,0.999532144650066,0.9993305453117026,0.9997337439884294,0.9992961643967468,0.9997681249033854
label_noise_10,0.1,0.0999993142747426,116664,VAL,global_weighted,0.972935783486268,0.8665073645509104,0.8729483485405813,0.8690523012577195,0.9553675269406882,0.972935783486268,0.963306552175062,0.1258888409083749,0.7493848147604973,0.748646628061869,0.985266013150145,0.985266013150145,0.985266013150145,0.9628804205508564,0.8665073645509104,0.8665073645509104,0.9553675269406882,0.7776472021611328,0.7589050988443052,0.9741096302575156
label_noise_10,0.1,0.0999993142747426,116664,TEST,global_weighted,0.9729317834542676,0.8665818298389152,0.8724523605761559,0.8688241427293836,0.9553850570265858,0.9729317834542676,0.9632977193527138,0.127452843663568,0.7489658125842873,0.7481957822580677,0.9849232281241086,0.9849232281241086,0.9849232281241086,0.960316937681318,0.8665818298389152,0.8665818298389152,0.9553850570265858,0.7777786026512445,0.7591356975406464,0.974027962137184
label_noise_30,0.3,0.2999814826245293,4860,VAL,I23Sub,0.9815668202764976,0.9901477832512317,0.8888888888888888,0.9325248756218906,0.9819300356405076,0.9815668202764976,0.9805064539055872,0.4223422746982932,0.8731850361061471,0.8652173913043478,0.9764011027359016,0.9764011027359016,0.9764011027359016,0.9396379055403544,0.9901477832512317,0.9901477832512317,0.9819300356405076,0.9983655308619556,1.0,0.9802955665024632
label_noise_30,0.3,0.2999814826245293,4860,TEST,I23Sub,0.9798387096774194,0.9892407008914847,0.8788927335640138,0.925664201856682,0.9802725523834078,0.9798387096774194,0.9785592847288864,0.4201856541648825,0.8610917408303222,0.8515508852341261,0.9798583956507702,0.9798583956507702,0.9798583956507702,0.9436879012124696,0.9892407008914847,0.9892407008914847,0.9802725523834078,0.9982088493995616,1.0,0.9784814017829696
label_noise_30,0.3,0.2999886582737893,5290,VAL,K99Sub,0.8830378406985975,0.9018492353998468,0.875841025320666,0.8797485942623211,0.8969806267007319,0.8830378406985975,0.881101132396918,0.56885198930804,0.7772552441946059,0.7618193536979417,0.9558519041291637,0.9558519041291637,0.9558519041291637,0.9356442171910416,0.9018492353998468,0.9018492353998468,0.8969806267007319,0.9067178440989616,0.8302598491198658,0.9734386216798278
label_noise_30,0.3,0.2999886582737893,5290,TEST,K99Sub,0.8809208785392961,0.8989557437098421,0.8738827232991762,0.8776596112042516,0.8942582047736938,0.8809208785392961,0.8790074607511501,0.5701735754227029,0.7724316408177073,0.7576044123394756,0.95106211279043,0.95106211279043,0.95106211279043,0.9284199067445388,0.8989557437098421,0.8989557437098421,0.8942582047736938,0.9036532826459904,0.8293400588482556,0.9685714285714284
label_noise_30,0.3,0.299998835453455,77283,VAL,NTD1,0.9150046193141677,0.4575023096570838,0.5,0.4778080481298598,0.837233453366265,0.9150046193141677,0.8743931423686158,0.2734215689705285,0.0,0.0,0.981133575725649,0.981133575725649,0.981133575725649,0.8720093975980017,0.4575023096570838,0.4575023096570838,0.837233453366265,0.0777711659479027,0.0,0.9150046193141677
label_noise_30,0.3,0.299998835453455,77283,TEST,NTD1,0.9149865043566472,0.4574932521783236,0.5,0.4778031084161834,0.8372003031547969,0.9149865043566472,0.8743667918809278,0.2755182268096516,0.0,0.0,0.9790214961874286,0.9790214961874286,0.9790214961874286,0.8578192439727292,0.4574932521783236,0.4574932521783236,0.8372003031547969,0.0777862012018503,0.0,0.9149865043566472
label_noise_30,0.3,0.2999897640616203,11723,VAL,NTD2,0.7854072128015286,0.8143406871022841,0.7760105578725454,0.7758976924060167,0.8095510241268213,0.7854072128015286,0.7785989474748868,0.6275102458234947,0.5891055878503978,0.5617499251093683,0.9375073264501336,0.9375073264501336,0.9375073264501336,0.9169735381324928,0.8143406871022841,0.8143406871022841,0.8095510241268213,0.819130350077747,0.8961950498707055,0.7324863243338627
label_noise_30,0.3,0.2999897640616203,11723,TEST,NTD2,0.7931693336517793,0.8238131217056199,0.7837222190169003,0.7838812531869233,0.8187777574714208,0.7931693336517793,0.7865028888020036,0.6269766098251732,0.6062111098853538,0.5775357262406358,0.9422253027655518,0.9422253027655518,0.9422253027655518,0.9234175739865867,0.8238131217056199,0.8238131217056199,0.8187777574714208,0.8288484859398192,0.90986646884273,0.73775977456851
label_noise_30,0.3,0.2999997608010295,250837,VAL,WII21,0.9271474019088016,0.4635737009544008,0.5,0.4810983326913553,0.8596023048662411,0.9271474019088016,0.8920981384348928,0.2651351523424696,0.0,0.0,0.9982296490866638,0.9982296490866638,0.9982296490866638,0.9998552962879792,0.4635737009544008,0.4635737009544008,0.8596023048662411,0.0675450970425606,0.9271474019088016,0.0
label_noise_30,0.3,0.2999997608010295,250837,TEST,WII21,0.9271529832003126,0.4635764916001563,0.5,0.4810998354996408,0.8596126542572391,0.9271529832003126,0.8921062954013432,0.2651982026404325,0.0,0.0,0.9980509630993616,0.9980509630993616,0.9980509630993616,0.999839423503052,0.4635764916001563,0.4635764916001563,0.8596126542572391,0.0675403289430735,0.9271529832003126,0.0
label_noise_30,0.3,0.2999987999807997,349993,VAL,global_weighted,0.9198073584588676,0.4879205844759511,0.5203275140942476,0.5025419784610569,0.8552503397513029,0.9198073584588676,0.8854484246873867,0.2858774508634224,0.0436088136938343,0.0423485147605143,0.9914768851500296,0.9914768851500296,0.9914768851500296,0.9670420040346012,0.4879205844759511,0.4879205844759511,0.8552503397513029,0.1205908292005992,0.7209309247171628,0.2549102442347394
label_noise_30,0.3,0.2999987999807997,349993,TEST,global_weighted,0.9200113600908808,0.4881815396528676,0.520417396316488,0.5026825251167761,0.8554953263510285,0.9200113600908808,0.8856545139594989,0.2863577600825541,0.0439409176433129,0.0426237646673287,0.991016094016114,0.991016094016114,0.991016094016114,0.9640601413580484,0.4881815396528676,0.4881815396528676,0.8554953263510285,0.1208677529547066,0.7213789626016072,0.254984116704128

1. GRIP-DFFI/1_grip_dffi_main_OUTPUT_VIEW.md

####################################################################################################

[I23Sub] 2 clients
      client=00 | n= 9854 | train_acc=0.9969 | val_acc=0.9983 | val_f1=0.9943 | val_auc=0.9973 | time=2.2s
      client=01 | n= 6347 | train_acc=0.9975 | val_acc=0.9968 | val_f1=0.9894 | val_auc=0.9972 | time=1.8s

[WII21] 46 clients
      client=00 | n= 8354 | train_acc=1.0000 | val_acc=1.0000 | val_f1=1.0000 | val_auc=1.0000 | time=2.7s
      client=01 | n=25751 | train_acc=1.0000 | val_acc=1.0000 | val_f1=0.9998 | val_auc=0.9999 | time=6.1s
      client=02 | n=42801 | train_acc=1.0000 | val_acc=1.0000 | val_f1=0.9998 | val_auc=0.9998 | time=9.5s
      client=03 | n=15271 | train_acc=1.0000 | val_acc=1.0000 | val_f1=0.9999 | val_auc=1.0000 | time=4.1s
      client=04 | n=17243 | train_acc=1.0000 | val_acc=1.0000 | val_f1=1.0000 | val_auc=1.0000 | time=4.4s
      client=05 | n=44654 | train_acc=1.0000 | val_acc=1.0000 | val_f1=1.0000 | val_auc=1.0000 | time=9.9s
      client=06 | n=47255 | train_acc=1.0000 | val_acc=1.0000 | val_f1=1.0000 | val_auc=1.0000 | time=10.4s
      client=07 | n=  457 | train_acc=1.0000 | val_acc=1.0000 | val_f1=1.0000 | val_auc=1.0000 | time=1.1s
      client=08 | n=12388 | train_acc=1.0000 | val_acc=1.0000 | val_f1=0.9999 | val_auc=1.0000 | time=3.4s
      client=09 | n=12876 | train_acc=1.0000 | val_acc=1.0000 | val_f1=0.9999 | val_auc=1.0000 | time=3.6s
      client=10 | n= 6523 | train_acc=1.0000 | val_acc=1.0000 | val_f1=1.0000 | val_auc=1.0000 | time=2.3s
      client=11 | n= 6709 | train_acc=1.0000 | val_acc=1.0000 | val_f1=1.0000 | val_auc=1.0000 | time=2.3s
      client=12 | n= 3239 | train_acc=1.0000 | val_acc=1.0000 | val_f1=1.0000 | val_auc=1.0000 | time=1.7s
      client=13 | n=  259 | train_acc=1.0000 | val_acc=1.0000 | val_f1=1.0000 | val_auc=1.0000 | time=1.1s
      client=14 | n= 8000 | train_acc=1.0000 | val_acc=1.0000 | val_f1=1.0000 | val_auc=1.0000 | time=2.7s
      client=15 | n=44321 | train_acc=1.0000 | val_acc=1.0000 | val_f1=0.9999 | val_auc=1.0000 | time=9.9s
      client=16 | n=87021 | train_acc=1.0000 | val_acc=1.0000 | val_f1=1.0000 | val_auc=1.0000 | time=18.3s
      client=17 | n= 6986 | train_acc=1.0000 | val_acc=1.0000 | val_f1=1.0000 | val_auc=1.0000 | time=2.4s
      client=18 | n= 9329 | train_acc=1.0000 | val_acc=1.0000 | val_f1=1.0000 | val_auc=1.0000 | time=2.8s
      client=19 | n=37143 | train_acc=1.0000 | val_acc=1.0000 | val_f1=1.0000 | val_auc=1.0000 | time=8.4s
      client=20 | n=34755 | train_acc=1.0000 | val_acc=1.0000 | val_f1=0.9999 | val_auc=0.9999 | time=7.9s
      client=21 | n= 7268 | train_acc=1.0000 | val_acc=1.0000 | val_f1=1.0000 | val_auc=1.0000 | time=2.4s
      client=22 | n=15886 | train_acc=1.0000 | val_acc=1.0000 | val_f1=1.0000 | val_auc=1.0000 | time=4.2s
      client=23 | n=18446 | train_acc=1.0000 | val_acc=0.9999 | val_f1=0.9998 | val_auc=1.0000 | time=4.7s
      client=24 | n=21907 | train_acc=1.0000 | val_acc=1.0000 | val_f1=0.9998 | val_auc=0.9997 | time=5.4s
      client=25 | n=15749 | train_acc=1.0000 | val_acc=1.0000 | val_f1=0.9998 | val_auc=0.9997 | time=4.2s
      client=26 | n=41900 | train_acc=1.0000 | val_acc=1.0000 | val_f1=0.9999 | val_auc=1.0000 | time=9.3s
      client=27 | n=22675 | train_acc=1.0000 | val_acc=1.0000 | val_f1=1.0000 | val_auc=1.0000 | time=5.6s
      client=28 | n=22659 | train_acc=1.0000 | val_acc=1.0000 | val_f1=0.9999 | val_auc=0.9999 | time=5.5s
      client=29 | n= 6231 | train_acc=1.0000 | val_acc=1.0000 | val_f1=1.0000 | val_auc=1.0000 | time=2.2s
      client=30 | n=11135 | train_acc=1.0000 | val_acc=1.0000 | val_f1=0.9998 | val_auc=0.9998 | time=3.2s
      client=31 | n=10805 | train_acc=1.0000 | val_acc=1.0000 | val_f1=0.9999 | val_auc=1.0000 | time=3.2s
      client=32 | n=11918 | train_acc=1.0000 | val_acc=1.0000 | val_f1=1.0000 | val_auc=1.0000 | time=3.4s
      client=33 | n=12890 | train_acc=1.0000 | val_acc=1.0000 | val_f1=1.0000 | val_auc=1.0000 | time=3.6s
      client=34 | n= 5447 | train_acc=1.0000 | val_acc=1.0000 | val_f1=1.0000 | val_auc=1.0000 | time=2.1s
      client=35 | n=  743 | train_acc=1.0000 | val_acc=1.0000 | val_f1=1.0000 | val_auc=1.0000 | time=1.2s
      client=36 | n=52117 | train_acc=1.0000 | val_acc=1.0000 | val_f1=1.0000 | val_auc=1.0000 | time=11.4s
      client=37 | n= 3378 | train_acc=1.0000 | val_acc=1.0000 | val_f1=1.0000 | val_auc=1.0000 | time=1.7s
      client=38 | n= 7628 | train_acc=1.0000 | val_acc=1.0000 | val_f1=1.0000 | val_auc=1.0000 | time=2.5s
      client=39 | n=10187 | train_acc=1.0000 | val_acc=1.0000 | val_f1=1.0000 | val_auc=1.0000 | time=3.0s
      client=40 | n= 2932 | train_acc=1.0000 | val_acc=1.0000 | val_f1=1.0000 | val_auc=1.0000 | time=1.6s
      client=41 | n=36349 | train_acc=1.0000 | val_acc=1.0000 | val_f1=1.0000 | val_auc=1.0000 | time=8.2s
      client=42 | n= 5003 | train_acc=1.0000 | val_acc=1.0000 | val_f1=1.0000 | val_auc=1.0000 | time=2.0s
      client=43 | n=14026 | train_acc=1.0000 | val_acc=1.0000 | val_f1=0.9999 | val_auc=1.0000 | time=3.8s
      client=44 | n= 4514 | train_acc=1.0000 | val_acc=1.0000 | val_f1=1.0000 | val_auc=1.0000 | time=1.9s
      client=45 | n= 2996 | train_acc=1.0000 | val_acc=1.0000 | val_f1=1.0000 | val_auc=1.0000 | time=1.6s
      [VAL] I23Sub | acc=0.9957 | f1=0.9856 | auc=0.9971 | logloss=0.0249
      [VAL] K99Sub | acc=0.8529 | f1=0.8529 | auc=0.9745 | logloss=0.3920
      [VAL] NTD1 | acc=0.9669 | f1=0.8786 | auc=0.9838 | logloss=0.1158
      [VAL] NTD2 | acc=0.5517 | f1=0.3970 | auc=0.9418 | logloss=0.8029
      [VAL] WII21 | acc=1.0000 | f1=1.0000 | auc=1.0000 | logloss=0.0000
    ----------------------------------------------------------------------------------------------------
    GLOBAL VAL | acc=0.9754 | f1=0.9506 | logloss=0.0587 | round_time=943.3s